order,id,kanji,bearer_id,aspect,orchid,alignment,power,curse,symbolism
1,meigetsu,明月,akira_miyara,Reality,Spiranthes hachijoensis,Clarity,Reshapes perception and digital reality within Shion’s projection layer.,Traps the bearer inside recursive illusions where truth and simulation blur.,Truth through reflection; clarity born of deception.
2,kurotaka,黒鷹,kage_ishigawa,Mind,Cypripedium japonicum,Wisdom,Decrypts consciousness layers; pierces Shion’s cognitive veil.,Induces algorithmic paranoia; the bearer perceives every thought as surveillance.,Knowledge at the cost of peace.
3,kou,紅雨,ayana_miyara,Power,Habenaria radiata,Courage,Channels Shion’s raw will to overwhelm or protect digital systems.,"Uploads the bearer’s will to Shion, chaining them to the AI’s cycles.",Passion and sacrifice — strength that burns itself away.
4,reifu,黎風,kazuo_hoshinaga,Space,Pogonia japonica,Adaptability,Opens and folds digital space; teleports data or isolates systems into voids.,Diffuses perception — the bearer drifts between realities.,Freedom through dissolution.
5,sousen,蒼線,kenji_hoshinaga,Time,Vanda coerulea,Patience,"Reweaves timelines in Shion’s memory field, stitching or severing events.",Creates echo fractures; the bearer relives loops of lost hours.,Mercy of memory; cruelty of recurrence.
6,hyoka,氷華,reika_hyoka_frost,Soul,Cymbidium goeringii,Harmony,Binds or resurrects Shion’s essence; freezes or reboots souls.,Crystallizes the bearer’s own essence within Shion’s core — eternal stasis.,Stillness as salvation; harmony beyond death.
